<?xml version="1.0"?>
<!DOCTYPE Report
[
<!ELEMENT Report (General ,(Doc|BPT)) >
<!ATTLIST Report ver CDATA #REQUIRED tmZone CDATA #REQUIRED>

<!ELEMENT General ( DocLocation ) >
<!ATTLIST General productName CDATA #REQUIRED productVer CDATA #REQUIRED os CDATA #REQUIRED host CDATA #REQUIRED qcserver CDATA #IMPLIED qcproject CDATA #IMPLIED  >

<!ELEMENT BPT (DName,Res,DVer?,TSet?,TInst?,NodeArgs,AdditionalInfo*,Doc*) >
<!ATTLIST BPT rID ID #REQUIRED >

<!ELEMENT Doc (DName,ConfName?,Res,DVer?,TSet?,TInst?,RunType?,DT?,AdditionalInfo*,Step*,DIter*,Step*,Action*,Doc*,Summary?,TestMaintenanceSummary*,NodeArgs?) >
<!ATTLIST Doc rID ID #REQUIRED type (Test|BC|BPTWrapperTest|Flow|Group) "Test" productName CDATA #REQUIRED BCIter CDATA #IMPLIED >

<!ELEMENT RunType ( #PCDATA )>
<!ATTLIST RunType fmStep (False|True) "False" batch (False|True) "False" upDesc (False|True) "False" upChk (False|True) "False" upAS (False|True) "False">

<!ELEMENT DName ( #PCDATA ) >

<!ELEMENT ConfName ( #PCDATA ) >

<!ELEMENT Res ( #PCDATA ) >

<!ELEMENT AdditionalInfo (AdditionalDataName,AdditionalDataValue ) >

<!ELEMENT AdditionalDataName ( #PCDATA ) >

<!ELEMENT AdditionalDataValue ( #PCDATA ) >

<!ELEMENT DVer ( #PCDATA ) >

<!ELEMENT TSet ( #PCDATA ) >

<!ELEMENT TInst ( #PCDATA ) >

<!ELEMENT DIter (Step*,Action+,Summary?,NodeArgs)>
<!ATTLIST DIter rID ID #REQUIRED iterID CDATA #REQUIRED>

<!ELEMENT DocLocation ( #PCDATA )>

<!ELEMENT Action (AName,AIter*,(Step|HtmlStep|Action)*,Summary,ActionMaintenanceSummary*,NodeArgs ) >
<!ATTLIST Action rID ID #REQUIRED>

<!ELEMENT AIter ((Step|HtmlStep|Action)*,Summary?,NodeArgs) >
<!ATTLIST AIter rID ID #REQUIRED iterID CDATA #REQUIRED>

<!ELEMENT AName ( #PCDATA ) >

<!ELEMENT TestMaintenanceSummary (ActionMaintenanceSummary*) >
<!ATTLIST TestMaintenanceSummary ObjectsAdded CDATA #REQUIRED ObjectsUpdated CDATA #REQUIRED StepsUpdated CDATA #REQUIRED StepsComments CDATA #REQUIRED><!ELEMENT ActionMaintenanceSummary (ObjectChange* ) >
<!ATTLIST ActionMaintenanceSummary Action CDATA #REQUIRED Objects CDATA #REQUIRED Updated CDATA #REQUIRED LinesTotal CDATA #REQUIRED Added CDATA #REQUIRED LinesUpdated CDATA #REQUIRED>

<!ELEMENT ObjectChange  (Hierarchy, PropertyChangeList* ) >
<!ATTLIST ObjectChange Operation CDATA #IMPLIED OriginalRepository CDATA #IMPLIED>

<!ELEMENT PropertyChangeList (PropertyDef*) >

<!ELEMENT PropertyDef (OriginalValue, NewValue) >
<!ATTLIST PropertyDef PropName CDATA #REQUIRED OriginRegularExpression (True|False) "False" NewRegularExpression (True|False) "False" AddedProperty (True|False) "False" >

<!ELEMENT OriginalValue ( #PCDATA )>

<!ELEMENT NewValue ( #PCDATA )>

<!ELEMENT Hierarchy  (ObjectName, Hierarchy*) >
<!ATTLIST Hierarchy MicClass CDATA #REQUIRED>

<!ELEMENT ObjectName  ( #PCDATA ) >

<!ELEMENT Step (Obj,Details,Time,TimeTick* ,(Step|HtmlStep|Doc)*,NodeArgs) >
<!ATTLIST Step rID ID #REQUIRED retval CDATA #IMPLIED>

<!ELEMENT HtmlStep (HTML,TimeTick*,(Step|HtmlStep|Doc)*,NodeArgs) >
<!ATTLIST HtmlStep rID ID #REQUIRED >

<!ELEMENT Obj ( #PCDATA ) >
<!ATTLIST Obj plainTxt (False|True) "True">

<!ELEMENT Details ( #PCDATA ) >
<!ATTLIST Details plainTxt (False|True) "True">

<!ELEMENT Time ( #PCDATA ) >

<!ELEMENT HTML ( #PCDATA ) >

<!ELEMENT Disp ( #PCDATA ) >

<!ELEMENT TimeTick ( #PCDATA ) >

<!ELEMENT NodeArgs (Disp,TopPane?,BtmPane?,ExtendedInfo? )>
<!ATTLIST NodeArgs eType CDATA #REQUIRED icon CDATA #REQUIRED nRep CDATA #REQUIRED UserNote CDATA #IMPLIED filter (False|True) "True">
<!ATTLIST NodeArgs status (Passed|Failed|Done|Warning|Information) "Done">
<!ATTLIST NodeArgs iconSel CDATA #IMPLIED nType CDATA #IMPLIED MovieMarker CDATA "">
<!ATTLIST NodeArgs Source CDATA #IMPLIED SourceLine CDATA #IMPLIED >

<!ELEMENT TopPane (Path)>

<!ELEMENT BtmPane ( (Path|WR)?,ASHilite?)>
<!ATTLIST BtmPane vType CDATA "HTML">

<!ELEMENT Path ( #PCDATA ) >

<!ELEMENT ASHilite ( #PCDATA ) >

<!ELEMENT WR ( #PCDATA ) >

<!ELEMENT ExtendedInfo ( StepData ) >

<!ATTLIST ExtendedInfo StepType CDATA #REQUIRED>
<!ELEMENT DT (NodeArgs) >
<!ATTLIST DT rID ID #REQUIRED>

<!ELEMENT Summary (Param*)>
<!ATTLIST Summary sTime CDATA #IMPLIED eTime CDATA #IMPLIED passed CDATA #IMPLIED failed CDATA #IMPLIED warnings CDATA #IMPLIED retval CDATA #IMPLIED stopped (False|True) "False" >

<!ELEMENT Param (ParamName,ParamVal)+ >
<!ATTLIST Param paramInOut (In|Out) "In">

<!ELEMENT ParamName ( #PCDATA ) >

<!ELEMENT ParamVal ( #PCDATA ) >

]
>
<Report ver="2.0" tmZone="India Standard Time">
<General productName="QuickTest Professional" productVer="11.00" os="Windows 7" host="HOME-PC"><DocLocation><![CDATA[C:\Users\Home\Desktop\Automation\QTP\Applications\RangeTool\Mainscript\RangeTool_DriverScript]]></DocLocation></General>
<Doc rID="T1"   productName= "QuickTest Professional"  >
<DName><![CDATA[RangeTool_DriverScript]]></DName>
<Res><![CDATA[Res4]]></Res>
<DT rID="T2">
<NodeArgs eType="Table" icon="2" nRep="4" filter="False" >
<Disp><![CDATA[Run-Time Data Table]]></Disp>
<BtmPane vType="Table">
<Path><![CDATA[Default.xls]]></Path>
</BtmPane>
</NodeArgs>
</DT>
<Action rID="T3">
<AName><![CDATA[Action1]]></AName>
<Step rID="T4">
<Obj plainTxt="False" ><![CDATA[SystemUtil]]></Obj>
<Details plainTxt="False" ><![CDATA[SystemUtil]]></Details>
<Time><![CDATA[6/26/2017 - 19:10:19]]></Time>
<TimeTick>1498484419</TimeTick>
<Step rID="T5">
<Obj plainTxt="False" ><![CDATA[Run "C:\Users\Home\Desktop\RangeTool.exe",1]]></Obj>
<Details plainTxt="False" ><![CDATA[Run "C:\Users\Home\Desktop\RangeTool.exe",1]]></Details>
<Time><![CDATA[6/26/2017 - 19:10:19]]></Time>
<TimeTick>1498484419</TimeTick>
<NodeArgs eType="Replay" icon="4" nRep="10" status="Passed" >
<Disp><![CDATA[Run "C:\Users\Home\Desktop\RangeTool.exe",1]]></Disp>
</NodeArgs>
</Step>
<NodeArgs eType="Replay" icon="4" nRep="9" status="Passed" >
<Disp><![CDATA[SystemUtil]]></Disp>
</NodeArgs>
</Step>
<Step rID="T6">
<Obj plainTxt="False" ><![CDATA[frmMain]]></Obj>
<Details plainTxt="False" ><![CDATA[VbWindow]]></Details>
<Time><![CDATA[6/26/2017 - 19:10:19]]></Time>
<TimeTick>1498484419</TimeTick>
<Step rID="T7">
<Obj plainTxt="False" ><![CDATA[txtMin.SetText]]></Obj>
<Details plainTxt="False" ><![CDATA[]]></Details>
<Time><![CDATA[6/26/2017 - 19:10:19]]></Time>
<TimeTick>1498484419</TimeTick>
<NodeArgs eType="Replay" icon="6" nRep="13" >
<Disp><![CDATA[txtMin.SetText]]></Disp>
</NodeArgs>
</Step>
<Step rID="T8">
<Obj plainTxt="False" ><![CDATA[txtMin.Type]]></Obj>
<Details plainTxt="False" ><![CDATA["&lt__MicTab&gt"]]></Details>
<Time><![CDATA[6/26/2017 - 19:10:19]]></Time>
<TimeTick>1498484419</TimeTick>
<NodeArgs eType="Replay" icon="6" nRep="15" >
<Disp><![CDATA[txtMin.Type]]></Disp>
</NodeArgs>
</Step>
<Step rID="T9">
<Obj plainTxt="False" ><![CDATA[txtMax.SetText]]></Obj>
<Details plainTxt="False" ><![CDATA[]]></Details>
<Time><![CDATA[6/26/2017 - 19:10:19]]></Time>
<TimeTick>1498484419</TimeTick>
<NodeArgs eType="Replay" icon="6" nRep="17" >
<Disp><![CDATA[txtMax.SetText]]></Disp>
</NodeArgs>
</Step>
<Step rID="T10">
<Obj plainTxt="False" ><![CDATA[txtMax.Type]]></Obj>
<Details plainTxt="False" ><![CDATA["&lt__MicTab&gt"]]></Details>
<Time><![CDATA[6/26/2017 - 19:10:19]]></Time>
<TimeTick>1498484419</TimeTick>
<NodeArgs eType="Replay" icon="6" nRep="19" >
<Disp><![CDATA[txtMax.Type]]></Disp>
</NodeArgs>
</Step>
<Step rID="T11">
<Obj plainTxt="False" ><![CDATA[txtLower.SetText]]></Obj>
<Details plainTxt="False" ><![CDATA[]]></Details>
<Time><![CDATA[6/26/2017 - 19:10:20]]></Time>
<TimeTick>1498484420</TimeTick>
<NodeArgs eType="Replay" icon="6" nRep="21" >
<Disp><![CDATA[txtLower.SetText]]></Disp>
</NodeArgs>
</Step>
<Step rID="T12">
<Obj plainTxt="False" ><![CDATA[txtLower.Type]]></Obj>
<Details plainTxt="False" ><![CDATA["&lt__MicTab&gt"]]></Details>
<Time><![CDATA[6/26/2017 - 19:10:20]]></Time>
<TimeTick>1498484420</TimeTick>
<NodeArgs eType="Replay" icon="6" nRep="23" >
<Disp><![CDATA[txtLower.Type]]></Disp>
</NodeArgs>
</Step>
<Step rID="T13">
<Obj plainTxt="False" ><![CDATA[txtUpper.SetText]]></Obj>
<Details plainTxt="False" ><![CDATA[]]></Details>
<Time><![CDATA[6/26/2017 - 19:10:20]]></Time>
<TimeTick>1498484420</TimeTick>
<NodeArgs eType="Replay" icon="6" nRep="25" >
<Disp><![CDATA[txtUpper.SetText]]></Disp>
</NodeArgs>
</Step>
<Step rID="T14">
<Obj plainTxt="False" ><![CDATA[txtUpper.Type]]></Obj>
<Details plainTxt="False" ><![CDATA["&lt__MicTab&gt"]]></Details>
<Time><![CDATA[6/26/2017 - 19:10:20]]></Time>
<TimeTick>1498484420</TimeTick>
<NodeArgs eType="Replay" icon="6" nRep="27" >
<Disp><![CDATA[txtUpper.Type]]></Disp>
</NodeArgs>
</Step>
<Step rID="T15">
<Obj plainTxt="False" ><![CDATA[lstStyle.Select]]></Obj>
<Details plainTxt="False" ><![CDATA[]]></Details>
<Time><![CDATA[6/26/2017 - 19:10:20]]></Time>
<TimeTick>1498484420</TimeTick>
<NodeArgs eType="Replay" icon="7" nRep="29" >
<Disp><![CDATA[lstStyle.Select]]></Disp>
</NodeArgs>
</Step>
<Step rID="T16">
<Obj plainTxt="False" ><![CDATA[Upper Locked.Set]]></Obj>
<Details plainTxt="False" ><![CDATA[]]></Details>
<Time><![CDATA[6/26/2017 - 19:10:21]]></Time>
<TimeTick>1498484421</TimeTick>
<NodeArgs eType="Replay" icon="8" nRep="31" >
<Disp><![CDATA[Upper Locked.Set]]></Disp>
</NodeArgs>
</Step>
<Step rID="T17">
<Obj plainTxt="False" ><![CDATA[Upper Visible.Set]]></Obj>
<Details plainTxt="False" ><![CDATA[]]></Details>
<Time><![CDATA[6/26/2017 - 19:10:21]]></Time>
<TimeTick>1498484421</TimeTick>
<NodeArgs eType="Replay" icon="8" nRep="33" >
<Disp><![CDATA[Upper Visible.Set]]></Disp>
</NodeArgs>
</Step>
<Step rID="T18">
<Obj plainTxt="False" ><![CDATA[Lower Visible.Set]]></Obj>
<Details plainTxt="False" ><![CDATA[]]></Details>
<Time><![CDATA[6/26/2017 - 19:10:21]]></Time>
<TimeTick>1498484421</TimeTick>
<NodeArgs eType="Replay" icon="8" nRep="35" >
<Disp><![CDATA[Lower Visible.Set]]></Disp>
</NodeArgs>
</Step>
<Step rID="T19">
<Obj plainTxt="False" ><![CDATA[Lower Locked.Set]]></Obj>
<Details plainTxt="False" ><![CDATA[]]></Details>
<Time><![CDATA[6/26/2017 - 19:10:22]]></Time>
<TimeTick>1498484422</TimeTick>
<NodeArgs eType="Replay" icon="8" nRep="37" >
<Disp><![CDATA[Lower Locked.Set]]></Disp>
</NodeArgs>
</Step>
<Step rID="T20">
<Obj plainTxt="False" ><![CDATA[Enabled.Set]]></Obj>
<Details plainTxt="False" ><![CDATA[]]></Details>
<Time><![CDATA[6/26/2017 - 19:10:22]]></Time>
<TimeTick>1498484422</TimeTick>
<NodeArgs eType="Replay" icon="8" nRep="39" >
<Disp><![CDATA[Enabled.Set]]></Disp>
</NodeArgs>
</Step>
<Step rID="T21">
<Obj plainTxt="False" ><![CDATA[SystemUtil]]></Obj>
<Details plainTxt="False" ><![CDATA[SystemUtil]]></Details>
<Time><![CDATA[6/26/2017 - 19:10:24]]></Time>
<TimeTick>1498484424</TimeTick>
<Step rID="T22">
<Obj plainTxt="False" ><![CDATA[Run "C:\Users\Home\Desktop\RangeTool.exe",1]]></Obj>
<Details plainTxt="False" ><![CDATA[Run "C:\Users\Home\Desktop\RangeTool.exe",1]]></Details>
<Time><![CDATA[6/26/2017 - 19:10:24]]></Time>
<TimeTick>1498484424</TimeTick>
<NodeArgs eType="Replay" icon="4" nRep="43" status="Passed" >
<Disp><![CDATA[Run "C:\Users\Home\Desktop\RangeTool.exe",1]]></Disp>
</NodeArgs>
</Step>
<NodeArgs eType="Replay" icon="4" nRep="42" status="Passed" >
<Disp><![CDATA[SystemUtil]]></Disp>
</NodeArgs>
</Step>
<Step rID="T23">
<Obj plainTxt="False" ><![CDATA[txtMin.SetText]]></Obj>
<Details plainTxt="False" ><![CDATA[]]></Details>
<Time><![CDATA[6/26/2017 - 19:10:24]]></Time>
<TimeTick>1498484424</TimeTick>
<NodeArgs eType="Replay" icon="6" nRep="45" >
<Disp><![CDATA[txtMin.SetText]]></Disp>
</NodeArgs>
</Step>
<Step rID="T24">
<Obj plainTxt="False" ><![CDATA[txtMin.Type]]></Obj>
<Details plainTxt="False" ><![CDATA["&lt__MicTab&gt"]]></Details>
<Time><![CDATA[6/26/2017 - 19:10:24]]></Time>
<TimeTick>1498484424</TimeTick>
<NodeArgs eType="Replay" icon="6" nRep="47" >
<Disp><![CDATA[txtMin.Type]]></Disp>
</NodeArgs>
</Step>
<Step rID="T25">
<Obj plainTxt="False" ><![CDATA[txtMax.SetText]]></Obj>
<Details plainTxt="False" ><![CDATA[]]></Details>
<Time><![CDATA[6/26/2017 - 19:10:24]]></Time>
<TimeTick>1498484424</TimeTick>
<NodeArgs eType="Replay" icon="6" nRep="49" >
<Disp><![CDATA[txtMax.SetText]]></Disp>
</NodeArgs>
</Step>
<Step rID="T26">
<Obj plainTxt="False" ><![CDATA[txtMax.Type]]></Obj>
<Details plainTxt="False" ><![CDATA["&lt__MicTab&gt"]]></Details>
<Time><![CDATA[6/26/2017 - 19:10:24]]></Time>
<TimeTick>1498484424</TimeTick>
<NodeArgs eType="Replay" icon="6" nRep="51" >
<Disp><![CDATA[txtMax.Type]]></Disp>
</NodeArgs>
</Step>
<Step rID="T27">
<Obj plainTxt="False" ><![CDATA[txtLower.SetText]]></Obj>
<Details plainTxt="False" ><![CDATA[]]></Details>
<Time><![CDATA[6/26/2017 - 19:10:25]]></Time>
<TimeTick>1498484425</TimeTick>
<NodeArgs eType="Replay" icon="6" nRep="53" >
<Disp><![CDATA[txtLower.SetText]]></Disp>
</NodeArgs>
</Step>
<Step rID="T28">
<Obj plainTxt="False" ><![CDATA[txtLower.Type]]></Obj>
<Details plainTxt="False" ><![CDATA["&lt__MicTab&gt"]]></Details>
<Time><![CDATA[6/26/2017 - 19:10:25]]></Time>
<TimeTick>1498484425</TimeTick>
<NodeArgs eType="Replay" icon="6" nRep="55" >
<Disp><![CDATA[txtLower.Type]]></Disp>
</NodeArgs>
</Step>
<Step rID="T29">
<Obj plainTxt="False" ><![CDATA[txtUpper.SetText]]></Obj>
<Details plainTxt="False" ><![CDATA[]]></Details>
<Time><![CDATA[6/26/2017 - 19:10:25]]></Time>
<TimeTick>1498484425</TimeTick>
<NodeArgs eType="Replay" icon="6" nRep="57" >
<Disp><![CDATA[txtUpper.SetText]]></Disp>
</NodeArgs>
</Step>
<Step rID="T30">
<Obj plainTxt="False" ><![CDATA[txtUpper.Type]]></Obj>
<Details plainTxt="False" ><![CDATA["&lt__MicTab&gt"]]></Details>
<Time><![CDATA[6/26/2017 - 19:10:25]]></Time>
<TimeTick>1498484425</TimeTick>
<NodeArgs eType="Replay" icon="6" nRep="59" >
<Disp><![CDATA[txtUpper.Type]]></Disp>
</NodeArgs>
</Step>
<Step rID="T31">
<Obj plainTxt="False" ><![CDATA[lstStyle.Select]]></Obj>
<Details plainTxt="False" ><![CDATA[]]></Details>
<Time><![CDATA[6/26/2017 - 19:10:25]]></Time>
<TimeTick>1498484425</TimeTick>
<NodeArgs eType="Replay" icon="7" nRep="61" >
<Disp><![CDATA[lstStyle.Select]]></Disp>
</NodeArgs>
</Step>
<Step rID="T32">
<Obj plainTxt="False" ><![CDATA[Upper Locked.Set]]></Obj>
<Details plainTxt="False" ><![CDATA[]]></Details>
<Time><![CDATA[6/26/2017 - 19:10:26]]></Time>
<TimeTick>1498484426</TimeTick>
<NodeArgs eType="Replay" icon="8" nRep="63" >
<Disp><![CDATA[Upper Locked.Set]]></Disp>
</NodeArgs>
</Step>
<Step rID="T33">
<Obj plainTxt="False" ><![CDATA[Upper Visible.Set]]></Obj>
<Details plainTxt="False" ><![CDATA[]]></Details>
<Time><![CDATA[6/26/2017 - 19:10:26]]></Time>
<TimeTick>1498484426</TimeTick>
<NodeArgs eType="Replay" icon="8" nRep="65" >
<Disp><![CDATA[Upper Visible.Set]]></Disp>
</NodeArgs>
</Step>
<Step rID="T34">
<Obj plainTxt="False" ><![CDATA[Lower Visible.Set]]></Obj>
<Details plainTxt="False" ><![CDATA[]]></Details>
<Time><![CDATA[6/26/2017 - 19:10:26]]></Time>
<TimeTick>1498484426</TimeTick>
<NodeArgs eType="Replay" icon="8" nRep="67" >
<Disp><![CDATA[Lower Visible.Set]]></Disp>
</NodeArgs>
</Step>
<Step rID="T35">
<Obj plainTxt="False" ><![CDATA[Lower Locked.Set]]></Obj>
<Details plainTxt="False" ><![CDATA[]]></Details>
<Time><![CDATA[6/26/2017 - 19:10:27]]></Time>
<TimeTick>1498484427</TimeTick>
<NodeArgs eType="Replay" icon="8" nRep="69" >
<Disp><![CDATA[Lower Locked.Set]]></Disp>
</NodeArgs>
</Step>
<Step rID="T36">
<Obj plainTxt="False" ><![CDATA[Enabled.Set]]></Obj>
<Details plainTxt="False" ><![CDATA[]]></Details>
<Time><![CDATA[6/26/2017 - 19:10:27]]></Time>
<TimeTick>1498484427</TimeTick>
<NodeArgs eType="Replay" icon="8" nRep="71" >
<Disp><![CDATA[Enabled.Set]]></Disp>
</NodeArgs>
</Step>
<Step rID="T37">
<Obj plainTxt="False" ><![CDATA[SystemUtil]]></Obj>
<Details plainTxt="False" ><![CDATA[SystemUtil]]></Details>
<Time><![CDATA[6/26/2017 - 19:10:28]]></Time>
<TimeTick>1498484428</TimeTick>
<Step rID="T38">
<Obj plainTxt="False" ><![CDATA[Run "C:\Users\Home\Desktop\Automation\QTP\Applications\RangeTool\Results\HTMLResults\Res4\ResultSummary.html",1]]></Obj>
<Details plainTxt="False" ><![CDATA[Run "C:\Users\Home\Desktop\Automation\QTP\Applications\RangeTool\Results\HTMLResults\Res4\ResultSummary.html",1]]></Details>
<Time><![CDATA[6/26/2017 - 19:10:28]]></Time>
<TimeTick>1498484428</TimeTick>
<NodeArgs eType="Replay" icon="4" nRep="75" status="Passed" >
<Disp><![CDATA[Run "C:\Users\Home\Desktop\Automation\QTP\Applications\RangeTool\Results\HTMLResults\Res4\ResultSummary.html",1]]></Disp>
</NodeArgs>
</Step>
<NodeArgs eType="Replay" icon="4" nRep="74" status="Passed" >
<Disp><![CDATA[SystemUtil]]></Disp>
</NodeArgs>
</Step>
<NodeArgs eType="Context" icon="5" nRep="12" status="Passed" >
<Disp><![CDATA[frmMain]]></Disp>
</NodeArgs>
</Step>
<Summary sTime="6/26/2017 - 19:10:17" eTime="6/26/2017 - 19:10:28" passed="3" failed="0" warnings="0" ></Summary>
<NodeArgs eType="StartAction" icon="3" nRep="6" status="Passed" >
<Disp><![CDATA[Action1 Summary]]></Disp>
</NodeArgs>
</Action>
<Summary sTime="6/26/2017 - 19:10:16" eTime="6/26/2017 - 19:10:28" passed="3" failed="0" warnings="0" ></Summary>
<NodeArgs eType="StartTest" icon="1" nRep="3" status="Passed" >
<Disp><![CDATA[Test RangeTool_DriverScript Summary]]></Disp>
</NodeArgs>
</Doc>
</Report>